TID,EN,AR,CN,CNT,DE,ES,FI,FR,HE,ID,IT,JP,KR,MS,NL,PL,PT,RU,TH,TR,VI
string,string,string,string,string,string,string,string,string,string,string,string,string,string,string,string,string,string,string,string,string,string
TID_GATCHA_BOX_INFO_2,"Contains a new Brawler, or a Gadget, or a Star Power, or Coins and Power Points for two brawlers. Some boxes contain a bonus Token Doubler!",يحتوي على بطل جديد أو جهاز أو قدرة خاصة أو نقود أو نقاط قوة لاثنين من الأبطال. تضم بعض الصناديق مضاعف أقراص إضافيًا.,可能包含金币和两个英雄的战力能量，或一个新英雄，或一种随身妙具，或一种星徽之力，部分宝箱还额外包含双倍奖章加成！,可能包含金幣和兩個英雄的能量點數，或一個新英雄，或一種武裝配件，或一種能力之星，部分寶箱還額外包含雙倍代幣加成！,"Enthält entweder einen neuen Brawler, ein Gadget, eine Starpower, oder Münzen und Powerpunkte für zwei Brawler. Einige Boxen enthalten darüber hinaus einen Markenverdoppler als Bonus!","Contiene un nuevo brawler, un gadget, una habilidad estelar, o monedas y puntos de fuerza para dos brawlers. Algunas cajas contienen un duplicador de fichas.","Sisältää joko uuden rämäpään, varusteen, tähtivoiman tai kolikoita ja tehopisteitä kahdelle rämäpäälle. Joissain lippaissa on bonuksena poletintuplaaja!","Contient soit un nouveau brawler, soit un gadget, soit un pouvoir star, soit des pièces, ainsi que des points de pouvoir pour deux brawlers. Certaines boîtes contiennent un doubleur de jetons bonus.",מכילה בראולר חדש או גאדג‘ט או כוח כוכב או מטבעות ונקודות כוח עבור שני בראולרים. חלק מהתיבות מכילות בונוס של מכפיל טוקנים!,"Berisi Jagoan baru, Gadget, Kekuatan Bintang, atau Koin + Poin Kekuatan untuk dua Jagoan. Beberapa kotak berisi bonus Pengganda Token!","Contiene monete e punti energia per due brawler, o uno tra i seguenti articoli: un nuovo brawler, un gadget o un'abilità stellare. Come bonus, alcune casse hanno anche un raddoppiagettoni!",新キャラ、ガジェット、スターパワー、コインにキャラ2人分のパワーポイントが入っています。一部のボックスにはダブルトークンも含まれます！,"새 브롤러, 가젯, 스타 파워, 코인 및 브롤러 2명의 PP가 포함되어 있습니다. 일부 상자에는 보너스 토큰 더블러가 들어있습니다!","Mengandungi satu Brawler baharu, Alat, Kuasa Bintang atau Syiling, dan Mata Kuasa untuk dua Brawler. Sesetengah kotak mengandungi Gandaan Token bonus!","Bevat een nieuwe knokker, een gadget, een sterrenkracht, of munten en krachtpunten voor twee knokkers. Sommige dozen bevatten een tokenverdubbelaar als bonus!",Zawiera Zawiera nowego Zadymiarza lub gadżet lub gwiezdną moc albo monety i punkty mocy dla dwóch Zadymiarzy. Niektóre skrzynki zawierają dodatkowo podwajacz żetonów!,"Contém um novo Brawler, um acessório, um poder de estrela, moedas ou pontos de poder para dois Brawlers. Algumas caixas contêm um duplicador de fichas extra!","Содержит или нового бойца, или гаджет, или звёздную силу, или монеты с очками силы для двух бойцов. В некоторых ящиках может попасться удвоитель жетонов!",มีบรอว์เลอร์ตัวใหม่ หรืออุปกรณ์เสริม หรือพลังดวงดาว หรือเหรียญ และค่าพลังสำหรับบรอว์เลอร์สองตัว บางกล่องก็มีโบนัสเป็นแพ็คทวีคูณโทเค็น!,"Ya iki savaşçı için güç puanı ve altın içerir, ya da şu ödüllerden birini verir: yeni bir savaşçı, aksesuar veya yıldız gücü. Bazı kutulardan bonus jeton katlayıcı çıkar!",Có chứa một Chiến binh Brawl mới hoặc một Phụ kiện hoặc một Sức mạnh Sao hoặc Xu và Điểm Sức mạnh cho 2 chiến binh brawl. Một vài hộp có chứa thêm một Bộ Nhân đôi Thẻ!
TID_BRAWL_BOX_INFO_2,"Each Brawl Box contains one of the following: a new Brawler, Power Points + Coins, a Gadget, or a Star Power. Additionally, you can get Token Doublers as a bonus.\n\nReward probabilities are:",يحتوي كل صندوق عراك على أحد العناصر التالية: بطل جديد ،أو نقاط قوة + نقود، أو جهاز، أو قدرة خاصة. إلى جانب ذلك، يمكنك الحصول على مضاعفي أقراص في صورة مكافأة إضافية.\n\nاحتمالات المكافآت كالتالي:,乱斗宝箱可能开出一个新英雄，或金币和两个英雄的战力能量，或一种随身妙具，或一种星徽之力。另外，还有可能额外开出双倍奖章加成。\n\n乱斗宝箱可能包含的内容概率如下：,亂鬥寶箱可能開出一個新英雄，或金幣和兩個英雄的能量點數，或一種武裝配件，或一種能力之星。另外，還有可能額外開出雙倍代幣加成。\n\n亂鬥寶箱可能包含的內容機率如下：,"Jede Brawlbox enthält eine der folgenden Belohnungen: einen neuen Brawler, Powerpunkte und Münzen, ein Gadget oder eine Starpower. Außerdem kannst du als Bonus Markenverdoppler bekommen.\n\nDie Erscheinungsraten von Belohnungen lauten wie folgt:","Las cajas brawl pueden contener lo siguiente: un nuevo brawler; puntos de fuerza y monedas; un gadget; o una habilidad estelar. Además, también pueden contener duplicadores de fichas.\n\nProbabilidades de recompensas:","Jokainen rähinälipas sisältää joko uuden rämäpään, tehopisteitä ja kolikoita, varusteen tai tähtivoiman. Lisäksi voit saada bonuksena poletintuplaajia.\n\nPalkintotodennäköisyydet:","Chaque boîte Brawl contient un des éléments suivants : nouveau brawler, points de pouvoir et pièces, un pouvoir star ou gadget. Vous pouvez aussi gagner des doubleurs de jetons bonus.\n\nProbabilités de récompense :","כל תיבת בראולר מכילה אחד מהדברים הבאים: בראולר חדש, נקודות כוח + מטבעות, גאדג‘ט או כוח כוכב. בנוסף, אפשר לקבל מכפילי טוקנים כבונוס. \n\nהסיכויים לזכות בפרסים הם:","Masing-masing Kotak Jagoan berisi salah satu dari barang berikut: Jagoan baru, Poin Kekuatan + Koin, Gadget, atau Kekuatan Bintang. Selain itu, kamu juga bisa mendapatkan bonus Pengganda Token.\n\nPeluang hadiah antara lain:","Le casse brawl contengono uno dei seguenti articoli: un nuovo brawler, un gadget, un'abilità stellare o punti energia e monete. In più puoi anche trovare dei raddoppiagettoni come bonus.\n\nOgni contenuto appare con le seguenti probabilità:",ブロスタボックスには、新キャラクター、パワーポイント＋コイン、ガジェット、スターパワーのどれかが入っています。また、ボーナスとして、ダブルトークンを入手できる可能性があります。\n\n報酬の入手確率は以下の通りです：,"각 브롤 상자에는 신규 브롤러, PP+코인, 가젯, 스타 파워 중 하나가 들어있습니다. 추가로 토큰 더블러를 보너스로 획득할 수 있습니다.\n\n보상 확률:","Setiap Kotak Brawl mengandungi salah satu item berikut: Brawler baharu, Mata Kuasa + Syiling, Alat, atau Kuasa Bintang. Selain itu, anda boleh mendapat bonus Gandaan Token.\n\nKebarangkalian ganjaran:","Elke knokdoos bevat een van de volgende beloningen: een nieuwe knokker, krachtpunten + munten, een gadget, of een sterrenkracht. Je kunt ook tokenverdubbelaars als bonus krijgen.\n\nDe waarschijnlijkheden voor de beloningen zijn:","Każda skrzynka Zadymiarza może zawierać: nowego Zadymiarza albo punkty mocy + monety, gadżet albo gwiezdną moc. Dodatkowo jako bonus można zdobyć podwajacze żetonów.\n\nPrawdopodobieństwa poszczególnych nagród są następujące:","Cada Caixa Brawl contém um dos seguintes itens: um novo Brawler, um poder de estrela, um acessório ou pontos de poder e moedas. Além disso, você pode conseguir duplicadores de fichas como bônus.\n\nAs probabilidades são:","В ящике может быть или новый боец, или очки силы с монетами, или гаджет, или звёздная сила. Вдобавок можно получить бонус — удвоитель жетонов.\n\nШансы получения наград:","กล่องบรอว์แต่ละกล่องจะมีหนึ่งในรางวัลดังต่อไปนี้: บรอว์เลอร์ใหม่, ค่าพลัง + เหรียญ, อุปกรณ์เสริม หรือพลังดวงดาว นอกจากนี้ คุณยังมีโอกาสได้รับแพ็คทวีคูณโทเค็นเป็นโบนัส\n\nความเป็นไปได้ของรางวัล ได้แก่:","Her savaş kutusunda şunlardan biri bulunur: yeni bir savaşçı, güç puanı + altın (birlikte), bir aksesuar veya bir yıldız gücü. Ayrıca, bonus olarak jeton katlayıcı çıkabilir.\n\nBu ödüllerin çıkma şansı şöyledir:","Mỗi Hộp Brawl sẽ chứa một trong các phần thưởng sau: một Chiến binh Brawl mới, Điểm Sức mạnh + Xu, một Phụ kiện, hoặc một Sức mạnh Sao. Thêm vào đó, bạn còn có thể nhận được phần thưởng phụ là Bộ Nhân đôi Thẻ.\n\nCác xác suất phần thưởng như sau:"
